{
  "$schema": "http://json-schema.org/draft-07/schema#",
  "$id": "https://openclaw-sdlc-multi-agent/contracts/result.schema.json",
  "title": "AgentResult",
  "description": "Agent 的权威完成结果；Manager 只能在 Runtime Guard 通过后据此推进状态。",
  "type": "object",
  "additionalProperties": true,
  "required": [
    "schema_version", "workflow_id", "task_id", "run_id", "agent_id", "role",
    "attempt", "started_at", "finished_at", "result_status",
    "summary_for_user", "summary_for_manager", "worktree_path_abs",
    "artifact_root_abs", "input_commit", "output_commit", "isolation_mode", "self_validation", "artifact_manifest_hash"
  ],
  "properties": {
    "schema_version": { "type": "integer", "minimum": 1, "description": "所遵循的 result 契约版本。" },
    "workflow_id": { "type": "string", "pattern": "^WF-", "description": "所属 workflow 的不可变标识，必须与上下文包一致。" },
    "task_id": { "type": "string", "pattern": "^TASK-", "description": "所属任务标识，必须与上下文包一致。" },
    "run_id": { "type": "string", "pattern": "^RUN-", "description": "本次执行实例标识，不能复用历史 run。" },
    "agent_id": { "type": "string", "description": "实际生成该结果的已分配 Agent ID。" },
    "role": { "type": "string", "description": "生成结果时所承担的角色。" },
    "attempt": { "type": "integer", "minimum": 1, "description": "该 task/run 的执行尝试序号，从 1 开始。" },
    "started_at": { "type": "string", "format": "date-time" },
    "finished_at": { "type": "string", "format": "date-time" },
    "result_status": {
      "type": "string",
      "enum": ["COMPLETED", "NEEDS_REWORK", "BLOCKED", "HUMAN_DECISION_REQUIRED", "FAILED"],
      "description": "Agent 对本次运行的最终判定；只能使用列出的枚举值，不能自造状态。"
    },
    "summary_for_user": { "type": "string", "description": "面向用户的可审计简要结论，不得虚构执行事实。" },
    "summary_for_manager": { "type": "string", "description": "供 Manager 向用户说明已验证结果的简要结论。" },
    "input_commit": { "type": ["string", "null"] },
    "output_commit": { "type": ["string", "null"] },
    "branch": { "type": ["string", "null"] },
    "worktree_path_abs": { "type": "string", "minLength": 1, "description": "本次任务获准使用的 worktree 绝对路径。" },
    "artifact_root_abs": { "type": "string", "minLength": 1, "description": "本次 run 不可变 artifact 根目录的绝对路径。" },
    "modified_files": { "type": "array", "items": { "type": "string" } },
    "created_files": { "type": "array", "items": { "type": "string" } },
    "deleted_files": { "type": "array", "items": { "type": "string" } },
    "report_files": { "type": "array", "items": { "type": "string" } },
    "command_record_refs": { "type": "array", "items": { "type": "string" } },
    "evidence_refs": { "type": "array", "items": { "type": "string" } },
    "claims": { "type": "array", "items": { "$ref": "#/definitions/claim" } },
    "findings": { "type": "array", "items": { "type": "object" } },
    "unresolved_issues": { "type": "array", "items": { "type": "string" } },
    "known_limitations": { "type": "array", "items": { "type": "string" } },
    "decisions_required": { "type": "array", "items": { "type": "object" } },
    "recommended_next_action": { "type": "string" },
    "git_status_after_completion": { "type": ["string", "null"] },
    "isolation_mode": { "type": "string", "enum": ["UNSANDBOXED_LOCAL", "SANDBOXED_DOCKER"], "description": "实际执行隔离级别；当 OPENCLAW_TEST_SANDBOX_ENABLED=true 时 TEST 必须为 SANDBOXED_DOCKER，否则必须为 UNSANDBOXED_LOCAL。" },
    "sandbox_attestation": { "type": ["object", "null"] },
    "self_validation": {
      "type": "object",
      "additionalProperties": true,
      "required": ["preflight_passed", "checks"],
      "properties": {
        "preflight_passed": { "type": "boolean", "description": "开始工作前身份、路径、上下文哈希检查是否全部通过。" },
        "checks": {
          "type": "array",
          "items": {
            "type": "object",
            "required": ["name", "status"],
            "properties": {
              "name": { "type": "string" },
              "status": { "type": "string", "enum": ["PASS", "FAIL", "UNKNOWN", "NOT_APPLICABLE"], "description": "单项自检结果，必须为该枚举之一。" },
              "detail": { "type": "string" }
            }
          }
        }
      }
    },
    "artifact_manifest_hash": { "type": "string", "pattern": "^[a-f0-9]{64}$" }
  },
  "allOf": [
    {
      "if": { "properties": { "isolation_mode": { "const": "SANDBOXED_DOCKER" } } },
      "then": { "required": ["sandbox_attestation"], "properties": { "sandbox_attestation": { "type": "object" } } }
    }
  ],
  "definitions": {
    "claim": {
      "type": "object",
      "required": ["claim_id", "statement", "classification"],
      "properties": {
        "claim_id": { "type": "string" },
        "statement": { "type": "string" },
        "classification": { "type": "string", "enum": ["OBSERVED", "INFERRED", "PROPOSED", "UNKNOWN"], "description": "声明的证据等级；仅 OBSERVED 可直接陈述为已发生事实。" },
        "evidence_refs": { "type": "array", "items": { "type": "string" } },
        "limitations": { "type": "string" },
        "observed_at": { "type": "string" }
      }
    }
  }
}
